{
  "$schema": "./schema.json",
  "ruleSet": "nutrition-labels",
  "dataVersion": "2026.10.28",
  "read": "2026-10-28",
  "labels": [
    {
      "id": "voiceover",
      "name": "VoiceOver",
      "criteria": "https://developer.apple.com/help/app-store-connect/manage-app-accessibility/voiceover-evaluation-criteria",
      "coverage": "partial",
      "checked": "Icon-only buttons without an accessibility label, and labels that name the control type.",
      "manual": "Complete every common task with VoiceOver alone: reading order, grouping, values and states, custom actions, focus in modal views."
    },
    {
      "id": "voice-control",
      "name": "Voice Control",
      "criteria": "https://developer.apple.com/help/app-store-connect/manage-app-accessibility/voice-control-evaluation-criteria",
      "coverage": "partial",
      "checked": "Icon-only buttons without a name Voice Control can show and say.",
      "manual": "Say \"Show names\" and \"Show numbers\" on every screen of the common tasks; reach swipe and long-press actions by voice; dictate into every text field."
    },
    {
      "id": "larger-text",
      "name": "Larger Text",
      "criteria": "https://developer.apple.com/help/app-store-connect/manage-app-accessibility/larger-text-evaluation-criteria",
      "coverage": "checked",
      "checked": "Text scaling turned off or capped below 200% (for the whole app or one view), and fixed font sizes that Dynamic Type does not scale.",
      "manual": "Use the common tasks at the largest accessibility text size: no overlapping text, no truncation that hides information."
    },
    {
      "id": "dark-interface",
      "name": "Dark Interface",
      "criteria": "https://developer.apple.com/help/app-store-connect/manage-app-accessibility/dark-interface-evaluation-criteria",
      "coverage": "checked",
      "checked": "A light appearance forced in Info.plist, the build settings, the Expo config or code; a Flutter app without a dark theme; asset colours without a dark variant.",
      "manual": "Use the common tasks in Dark Mode: no screen, sheet, web view or launch screen that flashes bright."
    },
    {
      "id": "differentiate-without-color",
      "name": "Differentiate Without Color Alone",
      "criteria": "https://developer.apple.com/help/app-store-connect/manage-app-accessibility/differentiate-without-color-alone-evaluation-criteria",
      "coverage": "manual",
      "checked": "Nothing: whether colour is the only difference is a question of design, not of code a11ylabel can read.",
      "manual": "Look for status, charts and selections told apart by colour alone; add a shape, symbol or text."
    },
    {
      "id": "sufficient-contrast",
      "name": "Sufficient Contrast",
      "criteria": "https://developer.apple.com/help/app-store-connect/manage-app-accessibility/sufficient-contrast-evaluation-criteria",
      "coverage": "hint",
      "checked": "Asset catalog colours without a high contrast variant for the Increase Contrast setting.",
      "manual": "Measure text and controls against their background: about 4.5:1 for most text, by default or with Increase Contrast."
    },
    {
      "id": "reduced-motion",
      "name": "Reduced Motion",
      "criteria": "https://developer.apple.com/help/app-store-connect/manage-app-accessibility/reduced-motion-evaluation-criteria",
      "coverage": "checked",
      "checked": "Repeating, parallax, 3D and auto-playing animations in an app that never reads the Reduce Motion setting, or in files that do not.",
      "manual": "Turn on Reduce Motion and use the common tasks: no spinning, scaling, parallax or auto-advancing motion left."
    },
    {
      "id": "captions",
      "name": "Captions",
      "criteria": "https://developer.apple.com/help/app-store-connect/manage-app-accessibility/captions-evaluation-criteria",
      "coverage": "hint",
      "checked": "Whether the app plays video, which makes the label apply.",
      "manual": "Check that the video and audio of the common tasks have captions or transcripts, and that people can tell which media is captioned."
    },
    {
      "id": "audio-descriptions",
      "name": "Audio Descriptions",
      "criteria": "https://developer.apple.com/help/app-store-connect/manage-app-accessibility/audio-descriptions-evaluation-criteria",
      "coverage": "hint",
      "checked": "Whether the app plays video, which makes the label apply.",
      "manual": "Check that the video of the common tasks offers an audio-described track."
    }
  ],
  "rules": [
    {
      "id": "A11Y101",
      "labels": ["larger-text"],
      "severity": "error",
      "title": "Text size locked for the whole app",
      "summary": "Text scaling is turned off or capped below 200% for every text of the app: React Native Text.defaultProps, a MediaQuery in a Flutter app's builder, or a Dynamic Type limit on a SwiftUI scene or a UIKit window. Apple's Larger Text criteria ask that text can grow to at least 200% or the system's largest size.",
      "sources": [
        {
          "title": "Larger Text evaluation criteria (App Store Connect Help)",
          "url": "https://developer.apple.com/help/app-store-connect/manage-app-accessibility/larger-text-evaluation-criteria"
        },
        {
          "title": "React Native Text: allowFontScaling, maxFontSizeMultiplier",
          "url": "https://reactnative.dev/docs/text"
        },
        {
          "title": "Flutter MediaQuery.withClampedTextScaling",
          "url": "https://api.flutter.dev/flutter/widgets/MediaQuery/withClampedTextScaling.html"
        },
        {
          "title": "SwiftUI dynamicTypeSize(_:)",
          "url": "https://developer.apple.com/documentation/swiftui/view/dynamictypesize(_:)"
        },
        {
          "title": "UIKit UIView.maximumContentSizeCategory",
          "url": "https://developer.apple.com/documentation/uikit/uiview/maximumcontentsizecategory"
        }
      ],
      "fixes": {
        "react-native": {
          "title": "Let every Text follow the system text size",
          "steps": [
            "Remove allowFontScaling = false from Text.defaultProps and TextInput.defaultProps.",
            "If the layout breaks at large sizes, set maxFontSizeMultiplier to 2 or more only where needed (0 removes the limit), and let rows wrap instead of truncating.",
            "Check the common tasks at the largest accessibility size (Settings > Accessibility > Display & Text Size > Larger Text)."
          ],
          "guide": "docs/guides/larger-text.md#react-native-and-expo"
        },
        "flutter": {
          "title": "Stop overriding the text scaler for the whole app",
          "steps": [
            "Remove the MediaQuery, MediaQuery.withNoTextScaling or TextScaler.noScaling that wraps the app in MaterialApp.builder.",
            "If a limit is needed, use MediaQuery.withClampedTextScaling with maxScaleFactor 2.0 or more, or clamp only the widgets that cannot grow.",
            "Check the common tasks at the largest accessibility size on an iOS simulator."
          ],
          "guide": "docs/guides/larger-text.md#flutter"
        },
        "swiftui": {
          "title": "Remove the Dynamic Type limit from the scene",
          "steps": [
            "Remove .dynamicTypeSize(…) from the WindowGroup content, or raise its upper bound to .accessibility3 or above (AX3 is the first size above 200% for body text).",
            "Put a limit only on the views that cannot grow, such as a tab bar, and give them .accessibilityShowsLargeContentViewer().",
            "Preview the screens with .dynamicTypeSize(.accessibility5)."
          ],
          "guide": "docs/guides/larger-text.md#swiftui"
        },
        "uikit": {
          "title": "Remove the content size limit from the window",
          "steps": [
            "Remove maximumContentSizeCategory from the window, or set it to .accessibilityExtraLarge (AX3) or larger.",
            "Limit only views that cannot grow and offer the Large Content Viewer for them (UILargeContentViewerInteraction).",
            "Check the common tasks at the largest accessibility size."
          ],
          "guide": "docs/guides/larger-text.md#uikit"
        }
      }
    },
    {
      "id": "A11Y102",
      "labels": ["larger-text"],
      "severity": "warning",
      "title": "Text that does not scale",
      "summary": "One text or view turns text scaling off: allowFontScaling={false}, TextScaler.noScaling or linear(1.0), adjustsFontForContentSizeCategory = false, or a fixed .dynamicTypeSize. Fine for a tab bar or other repeated navigation; a blocker for primary content.",
      "sources": [
        {
          "title": "Larger Text evaluation criteria (App Store Connect Help)",
          "url": "https://developer.apple.com/help/app-store-connect/manage-app-accessibility/larger-text-evaluation-criteria"
        },
        {
          "title": "React Native Text: allowFontScaling",
          "url": "https://reactnative.dev/docs/text"
        },
        {
          "title": "Flutter TextScaler.noScaling",
          "url": "https://api.flutter.dev/flutter/painting/TextScaler/noScaling-constant.html"
        },
        {
          "title": "UIKit adjustsFontForContentSizeCategory",
          "url": "https://developer.apple.com/documentation/uikit/uicontentsizecategoryadjusting/adjustsfontforcontentsizecategory"
        }
      ],
      "fixes": {
        "react-native": {
          "title": "Let this text scale",
          "steps": [
            "Remove allowFontScaling={false}; if the text truly cannot grow (a tab bar label), keep it and make sure its meaning is available another way.",
            "Let the container grow with the text: no fixed height, numberOfLines only where the full text is shown elsewhere."
          ],
          "guide": "docs/guides/larger-text.md#react-native-and-expo"
        },
        "flutter": {
          "title": "Let this text scale",